{
  "schema": "delib-deployments/v1",
  "updatedAt": "2026-09-01",
  "promise": "Only show a one-click button when the linked repository has a reproducible Cloudflare-native deployment path.",
  "recipes": [
    {
      "id": "delib-suite",
      "name": "Delib 審議拼圖",
      "status": "one-click",
      "tools": ["流程推薦", "Power Ranker", "成果收據", "跨工具資料層", "Agent 協作"],
      "summary": "一個 Worker 提供規劃、站內排序、短期收件室、通用資料轉接與公開成果短網址。",
      "runtime": "Cloudflare Workers + Static Assets + SQLite Durable Objects",
      "account": "需要自己的 Cloudflare 帳號；不需要 Delib 帳號。",
      "dataBoundary": "規劃預設不保存；只有主辦者明確建立的短期房間或公開成果會進入 Durable Objects。",
      "repositoryUrl": "https://github.com/mashbean/delib",
      "deployUrl": "https://deploy.workers.cloudflare.com/?url=https://github.com/mashbean/delib"
    },
    {
      "id": "pocket-polis",
      "name": "Pocket Polis",
      "status": "one-click",
      "tools": ["陳述蒐集", "同意／不同意／略過", "群組分析", "CSV 匯出"],
      "summary": "MIT 的單 Worker 口袋審議服務，可建立自己的活動主機。",
      "runtime": "Cloudflare Workers + SQLite Durable Objects",
      "account": "需要自己的 Cloudflare 帳號；參與者免登入。",
      "dataBoundary": "自己的部署就是資料控制者；主辦者需自行設定告知、保存與刪除政策。",
      "repositoryUrl": "https://github.com/mashbean/pocket-polis",
      "deployUrl": "https://deploy.workers.cloudflare.com/?url=https://github.com/mashbean/pocket-polis"
    },
    {
      "id": "call-in",
      "name": "Call-in",
      "status": "one-click",
      "tools": ["現場提問", "反應", "投票", "主持畫面"],
      "summary": "Apache-2.0 的現場互動服務，獨立活動預設七天到期。",
      "runtime": "Cloudflare Workers + SQLite Durable Objects",
      "account": "需要自己的 Cloudflare 帳號；活動參與者免登入。",
      "dataBoundary": "公開頁與含權限的設定／協作網址分開；管理網址不可公開。",
      "repositoryUrl": "https://github.com/mashbean/call-in",
      "deployUrl": "https://deploy.workers.cloudflare.com/?url=https://github.com/mashbean/call-in"
    }
  ],
  "operatorPaths": [
    {
      "id": "polis",
      "name": "Pol.is",
      "status": "shared-host",
      "summary": "完整官方能力需要 Node、Clojure math 與 PostgreSQL；建議由有維運責任的單一共用主機承接。",
      "currentPath": "Delib 可用既有對話或 Site ID 開啟站內工作區；polis.mashbean.net 則提供可直接代建的 Pocket Polis。"
    },
    {
      "id": "agora",
      "name": "Agora Citizen Network",
      "status": "shared-host",
      "summary": "自架需要 PostgreSQL、Valkey 與多個 TypeScript／Python 服務，不屬於免費單 Worker。",
      "currentPath": "Delib 已可內嵌現有公開對話，Pocket Polis 工作台可輸出 Agora Pol.is 三檔匯入包。"
    },
    {
      "id": "talk-to-the-city",
      "name": "Talk to the City",
      "status": "connected",
      "summary": "完整服務依賴 Firebase、Google Cloud Storage、Redis／PubSub 與模型服務。",
      "currentPath": "Delib 已連接官方建立 UI，並可從 Pocket Polis 輸出標準 comment CSV。"
    },
    {
      "id": "heyform",
      "name": "HeyForm",
      "status": "shared-host",
      "summary": "自架需要 MongoDB 與 Redis／KeyDB；不應包裝成 Cloudflare 免費一鍵部署。",
      "currentPath": "Delib 可在站內使用已發布的公開表單，資料仍直接送到 HeyForm。"
    },
    {
      "id": "harmonica",
      "name": "Harmonica",
      "status": "connected",
      "summary": "可透過正式 API 或 MCP 建立，但帳號、方案與資料仍由 Harmonica 管理。",
      "currentPath": "主辦者可用分頁內 API key 從 Delib 代建 session，Delib 不保存 key。"
    },
    {
      "id": "parti-demosx",
      "name": "Parti DemosX",
      "status": "needs-rehabilitation",
      "summary": "MIT 原始碼可用，但目前是 Tomcat、MySQL、Nginx 組合，且需先更新依賴、預設密碼與安全設定。",
      "currentPath": "完成可重現 build、安全掃描與資料出口測試後，才適合由維運者提供共用 instance。"
    }
  ]
}
